{
  "sessionId": "session-2026-09-05-t1",
  "sessionDate": "2026-09-05T09:29:00.000Z",
  "actor": "Jerry",
  "repo": "GundariuM",
  "task": {
    "id": "jerry-init.state-files",
    "title": "Initialize missing Jerry project-brain state files and run first validation pass.",
    "scope": ".jerry/ only",
    "constraints": [
      ".jerry/ only",
      "no gameplay",
      "no contracts",
      "no rewards",
      "no production config changes"
    ],
    "approval_basis": "Jerry spec approved by user; user told me to continue because the files were missing"
  },
  "outcome": "COMPLETE",
  "facts": [
    {
      "id": "jerry.project-brain.files-created",
      "label": "CONFIRMED",
      "claim": "state.md, context.md, active.md, done.md, log.md now exist in .jerry/.",
      "source": "Filesystem listing confirmed each file exists after write."
    },
    {
      "id": "jerry.project-brain.schemas-added",
      "label": "CONFIRMED",
      "claim": "task.json and task.md were added to .jerry/schemas/ during validation.",
      "source": "ls of .jerry/schemas/ confirmed task.json and task.md present."
    },
    {
      "id": "jerry.project-brain.gitignore-updated",
      "label": "CONFIRMED",
      "claim": ".gitignore now contains a .jerry/ entry so the brain stays local and is not pushed to the public site repo.",
      "source": "tail of .gitignore confirmed .jerry/ line present."
    },
    {
      "id": "gundarium.live-status",
      "label": "INFERRED",
      "claim": "GundariuM is live, contracts deployed, token GNRM in use, staking via streme.fun, token native superfluid.",
      "source": "Josh verbal confirmation. Not independently re-verified from live site or on-chain in this session."
    },
    {
      "id": "gundarium.federation-path-exists",
      "label": "CONFIRMED",
      "claim": "Federation path exists in code: src/lib/federation/warperKeeperClient.ts, src/app/api/federation/submit-battle-receipt/route.ts, src/lib/federation/proofHash.ts.",
      "source": "Files read directly earlier in this conversation."
    },
    {
      "id": "gundarium.warpkeeper-key-status",
      "label": "UNKNOWN",
      "claim": "Whether WARPER_KEEPER_ASSIGNMENT_KEY is set in Vercel env is unknown in this session.",
      "source": "No env access available this session; code only shows the path fails open when missing."
    },
    {
      "id": "gundarium.3d-engine-goal",
      "label": "INFERRED",
      "claim": "3D rendering engine for NFT mechs is Josh's approved current priority.",
      "source": "User statement. Not yet scoped into atomic tasks."
    }
  ],
  "evidence": [
    {
      "type": "file",
      "location": ".jerry/state.md",
      "note": "Created this session."
    },
    {
      "type": "file",
      "location": ".jerry/context.md",
      "note": "Created this session."
    },
    {
      "type": "file",
      "location": ".jerry/active.md",
      "note": "Created this session."
    },
    {
      "type": "file",
      "location": ".jerry/done.md",
      "note": "Created this session."
    },
    {
      "type": "file",
      "location": ".jerry/log.md",
      "note": "Created this session."
    },
    {
      "type": "file",
      "location": ".jerry/schemas/task.json",
      "note": "Created this session."
    },
    {
      "type": "file",
      "location": ".jerry/schemas/task.md",
      "note": "Created this session."
    },
    {
      "type": "file",
      "location": ".gitignore",
      "note": "Updated this session with .jerry/ entry."
    },
    {
      "type": "session",
      "location": ".jerry/log.md",
      "note": "Session 1 entry documents file reads, file creates, fact labels, and verification."
    }
  ],
  "carryforward": [
    {
      "id": "gundarium.warpkeeper-key-status",
      "label": "UNKNOWN",
      "claim": "Whether WARPER_KEEPER_ASSIGNMENT_KEY is set is unknown."
    },
    {
      "id": "gundarium.live-contract-addresses",
      "label": "UNKNOWN",
      "claim": "Exact live contract address set for each contract is unknown in this session."
    },
    {
      "id": "gundarium.live-env-set",
      "label": "UNKNOWN",
      "claim": "Live env var values are unknown except what code references."
    },
    {
      "id": "gundarium.dreamnet-roundtrip",
      "label": "UNKNOWN",
      "claim": "DreamNet receipt round trip is not confirmed in this session."
    },
    {
      "id": "gundarium.3d-engine-scope",
      "label": "INFERRED",
      "claim": "3D rendering engine is approved but not yet scoped."
    }
  ],
  "nextTask": {
    "id": "gundarium.3d-engine-scope",
    "title": "Scope the 3D rendering engine work into concrete deliverables and validation criteria.",
    "reason": "It is Josh's approved current priority and the next atomic step after Jerry brain setup."
  }
}
